{"correctionId": "699e18a8-e961-4354-8425-b8bae7971f6b", "agent": {"id": "model", "publicKey": "0BqfnaOjuXh3wyq_fIUj5_4-bZ1gJkFbtsGMk0IrEF4"}, "principal": {"id": "unknown", "type": "organization"}, "supersedes": {"receiptId": "a33ddd2b-d9d7-47d1-a02a-135eb6fb3e33", "digest": {"alg": "sha256", "digest": "PKqEx3YoN48ObjhQ7EC5eEwj974ZC16UWbG8y-Rran0"}}, "action": {"type": "test"}, "reason": "caf\u00e9 \ud83d\ude00", "trigger": "check_failed", "fix": {"type": "replace"}, "timestamp": "2026-09-10T03:13:04.252895+00:00", "metadata": {}, "signature": {"alg": "Ed25519", "kid": "0BqfnaOjuXh3wyq_fIUj5_4-bZ1gJkFbtsGMk0IrEF4", "publicKey": "0BqfnaOjuXh3wyq_fIUj5_4-bZ1gJkFbtsGMk0IrEF4", "canonicalization": "RFC8785", "sig": "oAA86wGBDlXgIxS9gggN9HDT2riGVqkGJ-yp6Q36aUnWNCqQJrq2RmKWSVA9K_60GbXU2qVb-UPeIy1slFiPDA"}}